 common_voice_de_21905077 , die kostengünstigste strategie mit den höchsten erfolgsaussichten ist eben die vorsorgeuntersuchung , Accent is Österreichisches Deutsch
 common_voice_de_25119456 , arriach ist damit die gemeinde kärntens mit dem zweithöchsten anteil an evangelischen gläubigen , Accent is Österreichisches Deutsch
 common_voice_de_18199949 , das strategiepapier zum handelskrieg unterliegt der höchsten geheimhaltungsstufe , Accent is Österreichisches Deutsch
 common_voice_de_17821711 , energie wird niemals verbraucht höchstens umgewandelt , Accent is Österreichisches Deutsch
 common_voice_de_17874440 , energie wird niemals verbraucht höchstens umgewandelt , Accent is Österreichisches Deutsch
 common_voice_de_24115764 , auf dieser ebene sollen hochleistungsrechner der höchsten leistungsklasse angesiedelt sein , Accent is Österreichisches Deutsch
 common_voice_de_20147876 , liga der fünfthöchsten liga der schweiz , Accent is Österreichisches Deutsch
 common_voice_de_18150738 , das strategiepapier zum handelskrieg unterliegt der höchsten geheimhaltungsstufe , Accent is Französisch Deutsch
 common_voice_de_18150781 , alles was es nicht schon seit jahrhunderten gibt wird höchstens als sekte anerkannt , Accent is Französisch Deutsch
 common_voice_de_18150817 , was man hier vorfindet eignet sich höchstens dazu die speichen zu verbiegen , Accent is Französisch Deutsch
 common_voice_de_18162284 , energie wird niemals verbraucht höchstens umgewandelt , Accent is Französisch Deutsch
 common_voice_de_20702754 , die viertausender frankreichs sind die höchsten gipfel des landes , Accent is Schweizerdeutsch
 common_voice_de_27383767 , auch in rumänien reicht die korruption und die vetternwirtschaft bis in die höchsten kreise , Accent is Schweizerdeutsch
 common_voice_de_17870983 , dafür kann ich höchstens noch den schrottpreis bezahlen , Accent is Schweizerdeutsch
 common_voice_de_32234580 , darüber hinaus darf jede nation insgesamt höchstens sieben athleten pro geschlecht entsenden , Accent is Schweizerdeutsch
 common_voice_de_32221342 , bis saisonende spielte er acht mal in der zweithöchsten spielklasse und machte ein tor , Accent is Schweizerdeutsch
 common_voice_de_32239104 , bis saisonende kam er zu zwölf einsätzen in der dritthöchsten spielklasse , Accent is Schweizerdeutsch
 common_voice_de_18357745 , dafür kann ich höchstens noch den schrottpreis bezahlen , Accent is Deutschland Deutsch
 common_voice_de_20059639 , die alternative die hierbei den höchsten wert erhält wird ausgewählt , Accent is Deutschland Deutsch
 common_voice_de_18103932 , dafür kann ich höchstens noch den schrottpreis bezahlen , Accent is Deutschland Deutsch
 common_voice_de_28180891 , vor allem angehörige dieses korps bildeten die ranghöchsten politischen leiter der partei , Accent is Deutschland Deutsch
 common_voice_de_17710092 , energie wird niemals verbraucht höchstens umgewandelt , Accent is Deutschland Deutsch
 common_voice_de_24250497 , es waren die höchsten platzierungen seiner karriere , Accent is Deutschland Deutsch
 common_voice_de_22409563 , saison der höchsten englischen fußballliga , Accent is Deutschland Deutsch
 common_voice_de_17990396 , alles was es nicht schon seit jahrhunderten gibt wird höchstens als sekte anerkannt , Accent is Deutschland Deutsch
 common_voice_de_18128423 , was man hier vorfindet eignet sich höchstens dazu die speichen zu verbiegen , Accent is Deutschland Deutsch
 common_voice_de_18192867 , energie wird niemals verbraucht höchstens umgewandelt , Accent is Deutschland Deutsch
 common_voice_de_17892167 , was man hier vorfindet eignet sich höchstens dazu die speichen zu verbiegen , Accent is Deutschland Deutsch
 common_voice_de_18108456 , das strategiepapier zum handelskrieg unterliegt der höchsten geheimhaltungsstufe , Accent is Deutschland Deutsch
 common_voice_de_17889201 , energie wird niemals verbraucht höchstens umgewandelt , Accent is Deutschland Deutsch
 common_voice_de_27947057 , für andere hohe bauwerke siehe liste der höchsten bauwerke in hamburg , Accent is Deutschland Deutsch
 common_voice_de_17821165 , energie wird niemals verbraucht höchstens umgewandelt , Accent is Deutschland Deutsch
 common_voice_de_18205897 , das strategiepapier zum handelskrieg unterliegt der höchsten geheimhaltungsstufe , Accent is Deutschland Deutsch
 common_voice_de_20139486 , jedes hindernis darf höchstens zwei mal durchfahren werden dabei ist die richtung gleichgültig , Accent is Deutschland Deutsch
 common_voice_de_25150334 , spielzeit der höchsten deutschen spielklasse im handball der männer in der geschichte der handballbundesliga , Accent is Deutschland Deutsch
 common_voice_de_17795002 , energie wird niemals verbraucht höchstens umgewandelt , Accent is Deutschland Deutsch
 common_voice_de_23781236 , er ist wohl derzeit der geldschein mit dem höchsten wert im umlauf , Accent is Deutschland Deutsch
 common_voice_de_23637039 , eishockeybundesliga war die zwölfte spielzeit der zweithöchsten deutschen eishockeyspielklasse , Accent is Deutschland Deutsch
 common_voice_de_18037721 , was man hier vorfindet eignet sich höchstens dazu die speichen zu verbiegen , Accent is Deutschland Deutsch
 common_voice_de_24475296 , ist es nicht positiv wenn hersteller darin konkurrieren wer die höchsten umweltstandards erreicht , Accent is Deutschland Deutsch
 common_voice_de_19837047 , der klub spielt derzeit in der höchsten albanischen liga der kategoria superiore , Accent is Deutschland Deutsch
 common_voice_de_26003494 , walton liegt unweit von liverpool und hat den höchsten mehrheitsanteil , Accent is Deutschland Deutsch
 common_voice_de_18251833 , energie wird niemals verbraucht höchstens umgewandelt , Accent is Deutschland Deutsch
 common_voice_de_17823477 , energie wird niemals verbraucht höchstens umgewandelt , Accent is Deutschland Deutsch
 common_voice_de_18237863 , was man hier vorfindet eignet sich höchstens dazu die speichen zu verbiegen , Accent is Deutschland Deutsch
 common_voice_de_20777612 , wenn es nicht reinerbig ist kann es höchstens zwei dieser veranlagungen haben , Accent is Deutschland Deutsch
 common_voice_de_26889116 , der verein führt die ewige tabelle der allsvenskan der höchsten schwedischen fußballliga an , Accent is Deutschland Deutsch
 common_voice_de_27065212 , aktuell spielt der verein in der höchsten liga des landes der indonesia super league , Accent is Deutschland Deutsch
 common_voice_de_17909783 , alles was es nicht schon seit jahrhunderten gibt wird höchstens als sekte anerkannt , Accent is Deutschland Deutsch
 common_voice_de_19012171 , bei mir können sie höchstens knoblauch riechen aber keinen alkohol , Accent is Deutschland Deutsch
 common_voice_de_27028455 , auf jeder seite befinden sich fünf bis höchstens neun zähnchen , Accent is Deutschland Deutsch
 common_voice_de_19785000 , sie waren das erste verheiratete paar auf dem höchsten gipfel der erde , Accent is Deutschland Deutsch
 common_voice_de_18237672 , energie wird niemals verbraucht höchstens umgewandelt , Accent is Deutschland Deutsch
 common_voice_de_22272767 , es gilt den höchsten international anerkannten sicherheitsstandard als kriterium zu nehmen , Accent is Deutschland Deutsch
 common_voice_de_19762250 , am höchsten punkt der verbindungsstraße von pirmasens nach lemberg stand eine steinerne ruhbank , Accent is Deutschland Deutsch
 common_voice_de_17994540 , alles was es nicht schon seit jahrhunderten gibt wird höchstens als sekte anerkannt , Accent is Deutschland Deutsch
 common_voice_de_18915760 , bei solchen forderungen aus der höchsten ebene kann einem nur angst und bange werden , Accent is Deutschland Deutsch
 clips , er zählt zu den höchsten in der adria , Accent is Kanadisches Deutsch
